text,label
good game doesn’t know why there's freemason symbolism everywhere but I'm not surprised,1
"there are other challenges added to the game as well, such as random natural disasters, temperature maintenance, epidemic control, community hospitals where you have to complete challenges to earn money, and more.",1
"I was kinda intrigued when I found out that unlike hospital tycoon, this game is backed by the creators of the original theme hospital. They even listened to their fans- due to the outcry, two point studios has convinced sega to ditch denuvo and ",1
very easy to get the hang of even if you have not played theme hospital before.,2
maybe I will try it again in a year or so and see if it is gotten better.,1
"added it to my Wishlist, then I finally bought it a couple days ago.",2
hen game starts mute your mic and sound in discord- all players turn off hud and friendly name plates - only use In-game proximity VOIP to talk- split up into groups of 2-3 or solo around the map- after Round or if a player dies they can unmute in discord but cannot use the in-game VOIP- ,1
it provides a very chill and easy experience so you can get that space exploration without a powerful computer or hours of game play practice.,2
"once you start a school year you essentially just sit around and twiddle your thumbs, unless some kind of emergency occurs.",0
"Got out of ship, fell through terrain, landed on the planets core, saw a picture of Sean Murray that said ""Just like no one will discover I never put multiplayer into the game, no one will ever discover this easter egg""",1
there is a lot of split second decisions you need to make or you fail.,1
"If it was ALSO a good shooter, if space fights required skills and somehow changed the universe, and there were real factions with like wars and stuff going on, sure, then it could be a whole different experience.",1
"if you watch the trailer and like what you see, that is what you are going to get with RON",1
capitalize education and build a campus that trains nobody for real-world jobs.,1
"maybe I do not know the hotkeys/easier ways to do it, but queue management could be better (when you want to choose a bunch of people to kick out of the hospital). a button to kick or send to treatment while looking at the queue list would be great.",0
I dislike how when I click find session to play with strangers it kicks me back to main menu and tells me I lost connection to the server host.,0
The tactical FPS genre seriously needed its standards raised.,0
But there can more than 5 players...  your voice is specialized so people hear you only up close. Other channels are more convenient as the hear you wherever you are.,2
 create an immersive and memorable experience.,2
"The menus drift around, the galaxy map is just awful to interact with,, the in-game guide has key words highlighted in arbitrary colours that don't provide any additional information, the different economies are represented by names/symbols/colours that are not ever shown  together, etc etc etc.",0
"You have no idea what's coming ahead of you and the levels are procedurally generated, meaning if one room was empty during one playthrough, it could contain suspects and/or civilians in the next.",1
"If you managed to survive not getting shot by a random enemy AI that spotted you through a miniscule gap in a wall, well done, ",0
"The New Zealand-based game developing company, Void Interactive, is set to release their realistic first-person shooter SWAT game, Ready or Not.",1
" so if you are the sort of hard-core gamer who wants to have your hospital demolished in front of you and handed back in pieces so you can start over because you mismanaged it, this might not be your cup of tea.",0
if you enjoyed theme hospital from the late 90 is then this is definitely a game for you.,2
"A friend of mine recently begged, wheedled, cajoled, and begged some more for me to try it. ",2
 My game stopped responding.,0
i only play VR mode,1
I enjoy this game a lot and it is great to play while listening to podcasts.,2
"this is a good game with fun content. however, it is far too expensive. the regional pricing that exists on this game is utterly discriminatory. when the game can be had for a 1/6th of the price if you live somewhere else, it is patently unfair. ",0
"This isn't a shooter, it's a horror game.",0
 and a cryptic story to slowly explore;,2
 the reviews are far too kind as is.,0
"my specs (3060, i7-11700f, 16gb ram)",1
"SWAT 4 for me was easily the pinnacle in tactical FPS games and RON has taken that spot now,  building off of the concept that existed and refining it for a modern gaming generation.",2
there is no good reason for me to be getting a steady 11-20 fps on this game with that equipment.,0
" about 1/4 of the games I play I find that my teammates are muted when they speak, though they can still hear me.",0
"My friend and I who were playing SWAT 4 at the time, had pretty much exhausted everything you could do in that game.",1
with the only option to advance using the left mouse button (LMB) and selecting options with either the mouse or 1-4 keys. ,0
This game is a work of artistic expression that puts you in the shoes of a SWAT officer following protocol in high-risk high-pressure situations. ,2
"Loving it so far, just got to get used to the flight stuff. Got motion sick as hell",2
"No idea who these people are, how many hostages, the floor plans, nothing. You're going in completely blind and you're welcome to die multiple times before you have any idea what you're dealing with.",1
d it is a fun hospital management game with ,2
needs work. Sadly the gameplay doesn't do the screenshots justice.,0
"I unlocked the Permadeath achievement, so I am finally, finally free.... to start a new save",1
A lot of new content is pushed out in every update ,2
Do not play this game in vr though it is VERY hard to control,0
Was that a future Two Point Zoo Easter Egg on the radio? Because if so... just take my money now...,2
some very easy beginner levels with more difficult ones thrown in once you progress further.,2
there was very little challenge.,0
and also have other modded players join you.,1
"incredibly addictive game-play,",2
but if you are willing to play what’s here right now it should be a good time.,2
 lots of fun pop culture references.,2
I think every PD in the US should use this game as an asset in testing their new applicants to see if they're qualified or not.,1
 it would be super cool if I could use a Scuff controller.,0
" they combined the regular inventory & cargo slots into one list, and you can now only equip tech upgrades in Technology slots, meaning that any upgrades equipped to a normal inventory slot became unequipped, but was left in your inventory as a regular item that you can just re-equip at any time as long as you have an available tech slot for it. ",2
two point hospital is a shallow room spam to cope with the ever-increasing hordes of patients,0
"something about building my own campus and interacting with the students had an appeal, but now I realize its just two point hospital but instead of a hospital, it’s a campus.",1
"have only encountered one glitch so far where a patient got ""stuck"" on a building, and no matter how I moved things away from him he would not unstick. after nearly three years in my hospital he is still standing there complaining.",0
Please BUT PLEASE PLEASE PLEASE ADD VR TO THIS GAME IT WOULD BE SO SICK,1
I am a huge Tarkov fan,2
"I should have bought Cooking Simulator VR and the original combo because it was just three dollars more for TWO games, instead I paid double the price for this garbage 1/3 made piece of garbage. ",0
 there is still no left-handed support,0
"When a player settles down on a planet and makes a base, and the things they find there can become interesting just because of the connection to that procedural content.",2
"I would really appreciate filters in video settings. I use Geforce experience to turn it B&W, add some grain and letterbox.. . I think if they added that touch along with other filters it would be an amazing experience. I would ideally like a B&W experience with red blood.",0
"i have found that the main complaint, pathfinding, can almost always be attributed to poor design/placement of walls/items. by realizing that people form a line at many places, example - reception, and if that line backs into any other line, example - vending machines, or object, examples - radiators/plants, they bug out. this is especially a problem in wards as where you put screens or plaster casters drastically impact how people move through the room.",0
"only that I am locked in perpetual combat with sentinels and pirates and god knows what else everywhere I go, on foot, in a ship, everywhere I travel is non-stop, constant mind-numbingly tedious spin-in-circles hold-down-LMB combat.",0
"Ores We can use ores to create almost anything or to trade, and it is necessary for us to obtain ores from each planet.",1
"Sometimes the 'profanity' filter disallows some names that are not profanity (in english at least, I tried making up a few latin-esque names and a few got blocked whereas they have no basis or resemblance to any profanity in english) If you are into that kinda thing, it is great...",0
"Difficulty that stems from resource management, the tactical situations presented, the context of S. W. A. T work with the constraints that presents and ",1
"The Atlas is a mystery. I have barely deciphered the first alien race is language I have encountered, but slowly learning to communicate. I am really curious about these infected stations I keep encountering...There is some kind of backstory to the sentinels being some kind of self-replicating machines that took over the universe, and I am excited to find out more about it.",2
"Playing this game with a mic is a MUST, communication is very important, this game made me buy a proper headset so I could communicate, ",2
 This means you should only use lethal force if necessary and are promoted to arrest over killing and find/mark all evidence for a better grade (You can only get a S if you don't kill anyone).,1
hopefully at some point we might get a ps4 version so people like my husband could enjoy it!,1
After the first 15 hours ,1
" that being said you need to find the right design, staffing and economic strategies for keeping a good, hygienic and financially viable hospital. you should also remember not to loose sight of your objectives, as you will find yourself quickly falling neck deep into a very messy dose of mayhem, chaos and bodily fluids!",1
" I have quite the game with saving my progress and started it again. everything was once again smooth. however, the nasty surprise came when I attempted to continue my saved progress. as I was welcomed by basically a message “your save is corrupted, cannot be loaded, we are sorry.” which I am sorry as well.",0
" eventually each map will have 4 different difficulty settings/""scenarios. "" ",1
"There's no gravity, except when your boots are actually on the ground. You don't orbit a planet. You don't need to think about your path through a solar system.",0
 Here I can only randomly walk and grind and walk and grind. It's too easy and boring.,0
"Nevertheless, I've never seen so many dumb people gathered in one place but in this game. People nowadays don't use their brains nor are ready for anything, they need to get help at many levels, assistance, and don't accept defeat, impatient and so on ...  it is pathetic.",0
"Also a hint from my experience, make use of the biggest loan you can as you can easily get overwhelmed if you don not build enough quickly enough.",1
There are other games for such difficult content.  What I always enjoyed about No Man's Sky is that it (and the combat) used to be very accessible for casual gamers.,1
This is probably the best exploration slash survival game out their in general and almost certainly bar none in the sci-fi genre.,2
I prefer you should play with your friends if you have much as you can ,1
I might like this game if you did not need to play through the campaign to unlock sandbox mode which is just a pain,0
Excellent tactical simulation of an alternate universe where police actually use their militarization to stop crimes instead of waiting outside of elementary schools as they're being shot up.,2
Long description: Team communication makes or breaks this game. ,1
"every time you interact with anything it's not instant, whether it's a world action or a menu selection. It feels sluggish.",0
I came back to playing it recently and,1
 despite having four crackheads lighting him up with pistols less accurate than my Spanish learned solely from drunken Duolingo lessons.,0
 I play this with my 6-year-old son,1
"Very fun game, exceeds expectations year after year with continued FREE updates",2
Crazy realistic swat vibes that really has never been done before; the game has a lot of detail along with the fact that it feels like you are a swat member absolutely NUTS,2
This game will punish you for every decision made without mercy.,2
that you can still explore which is cool.,2
"I didn't play early on, so I don't know how bad it was, but given hundreds of games in my Library and I've played PC games since 1994, this one takes the cake.",1
in beta matchmaking is completely random and hopefully you would be able to filter for servers with mics and certain level of experience,1
"Amazing, truly an immersive tactical shooter which ",2
"but then again, I am running a 5960x and a 1080ti so not really a good benchmark to test against.",0
with modifiers and recent balance changes have made the game more diverse and while still little easy much more agency is allotted to the player to improve reliability while also still being relatively unpredictable,2
only complaint have is the randomness of the symbols and items once had run with tombs and urns but without anything that can destroy them or that synergies with spirits wish symbols and items would be either automatically rigged little towards your synergies could be rigged by the player with luck statistic that other None can increase synergy capsule or different type of rare currency with which you could even possibly choose the symbol you want the next symbols to synergize with,0
This is the most underrated title out there imo.,2
Only had RoN for a few days,1
it's also frequently on sale for -50%,1
"It's not GTFO style hard, ",1
this would be more fun if the navigation and placing items were easier.,0
i understand from some of the other reviews ,1
"I'm 34, I'm old and demanding and ",0
 incredibly LOUD.,1
One thing this game has down is the equipment selection and customization. This works very well.,2
"such a fun game, I have only played this a bit here on steam but have almost 20 stars on xbox.",1
 but I am unable to continue playing it because the crashing issue I do not want to refund the game but feel might as well due to not being able to play it.so keep this in mind if your going to buy this game as you might not get to go past the first hospital :(,0
Played like 6 hours with 2 friends and saw 100% of what the game has to offer within the first 4 or so.,1
 You can get such crazy things like jetpack that emits rainbows or some badass bounty hunter helmet for your character.,2
 and graphics can be adjusted to allow you to enjoy the best experience.,2
"""Any sufficiently advanced technology is indistinguishable from magic. "" The 3-rd law by Arthur C. Clarke. I started a review with Clarke's quotation, because the world of ""No Man's Sky"" is really magical despite its obvious sci-fi basis. ",2
 it will run from buttery smooth to hard freezing and stuttering and always in the worst moments.,0
but at bare minimum I have high respect for the developers for retaining their credibility through actions and not photo shopping a PR statement when making a huge mistake which seems to be the norm nowadays.,2
only dislike is I suck on keyboard. I play on xbox remote.,0
It's very easy to have a bad time without other players on voice chat to distract you from,1
"feel very early access and amateurish, compared to modern production, but if you look at it from the nostalgia eye; it feels like a natural evolution of what you see in theme hospital.",1
"had my reservations, but it is actually pretty good! All of the goodness of the original, with extra added details.",2
"For a 10 year old kid I think this game will probably fulfil what they want out of it, however,  for a seasoned adult gamer ",1
"I never played theme hospital (insert boos and hisses here), but I did play sim theme park, another bullfrog title (insert cheers here).",1
hopefully not at the cost of IRL currency. Maybe some in game currency and a way to earn it would be cool? along with a shop?,0
The option just pops up whenever it wants.,0
some could argue it is not high on difficulty though virtual reality paradise players might be exaggerating about all the negatives. difficulty is not high ,0
the game play loop in my honest opinion is not enjoyable. Now I will say I did not play this game extensively only about an hour and a half but in that hour and half I felt pretty solid in my decision to refund it before the two hour time limit.,0
You can't do the campaign with other players/friends ,0
There is a steep learning curve to become familiar with the games technology but that is part of the fun.,2
easy to control via steam controller.,2
"there is a lot of community for it, on reddit, YouTube, discord, and the game is own forums, where you can find strategy guides, tips and people to work with on online projects to unlock additional items.",2
"Find your perfect planet, build your perfect base/home and ",1
The AI can do a full rotation in 0.1 seconds and shoot you down with 100% accuracy and ,0
" its only tutorial is a store page video (no tooltips, no guiding voice, no handholding) ",0
using night vision is cool.,2
"All-in-all, a great game for fans of the SWAT series, ",2
" I’m using it to smuggle drugs, guns, and alien nazi symbols to space stations",1
"I'm new to these types of games but I like it, however I feel that the difficulty could be tweaked, ",0
Swat 3 is a 9 if that game would run on any PC nowadays. ,1
The Enemies and the civilians can be superposed over each other ,0
 like you would otherwise in CSGO or COD or something...,1
"A basic tutorial guide is really needed, when enter lobby section (also the training/briefing place) of the game, you will not know what to do & where to go, or, when you customise your guns, attachments are not there, you have run around to find the quartermaster to take attachments, really confused, because the game don't have basic guides.",0
so it would be helpful to add a difficulty setting.,0
"I first built the hospitals rooms for aesthetics, ",1
"I learned a lot of skills on to how to properly diagnose and cure a plethora of diseases, and most importantly on how to keep my co-workers happy.",2
the game started feeling like a grind.,0
"It just feels too rigid currently. Someone charges you, and you put two rounds of beanbag in their chest at medium range, following it up with a close range kneecap, should NOT kill them. They need to introduce the ""Incapacitated suspect/Civillian"", as at least that was a good middle ground if you didn't just twitch and blow someone’s head off, you could save your final score a bit by just kneecapping the bastards.",0
"I am a voice actor, would love to help you out if you're in need of new (or more) voice lines.",1
 isn’t blowing my hair back with graphics or AI interaction and voice lines.,0
I played it for the grand total of 75 minutes. ,1
but it is not good because there is no Korean language support.,0
"like always, I was tempted to play it due to the influence of gaming youtubers, ",2
"This game has 1 achievement ""First arrest"" and all you have to do is detain one person. 56% of players have this achievement... The other 44% of players take no prisoners",1
"you cannot afford to take any risks with this game, and every game is different so you never know where the enemies are, or the bombs. Absolute classic which I have no doubt I will still be playing when I'm a really old man.",2
I preordered this game because I was so excited for it after playing two point hospital.,2
"won’t hesitate to ban / mute you no matter the context (even if you are pointing out what someone said is wrong, if you repeat after them you are gone)",0
played this both on Xbox and on pc. ,1
seeing it on my Wishlist for way too long.,1
" it is ... a more scaled-back, mindless experience,",2
"the hospitals kept me going for a long time, I haven not finished those yet but sadly, ",0
"Whether you choose to embark on a solitary journey of discovery or team up with friends in multiplayer mode, the game offers a multitude of paths to follow and goals to achieve.",1
 immersive (though flawed) sound design.,0
I am a huge fan of building and management games. ,2
"Not sure how much of this falls in the ""Early Access"" aspect of it",1
i participated in NMS Twitch drops and on twitch inventory I have skins that I got through it ,1
" the game is in early access,",1
"it is a fun to game to play while listening to podcasts, but the funny voice lies make it worth playing unmuted. Fun and relaxing",2
Will you bring a battering ram to bust through a door or bring a shield to take some extra bullets? Will you go in quiet with silencers and night vision goggles or breach the site with explosives and wipe out the enemy's with shotguns? The choice is yours to make.,1
 well over 1100 hrs played.,2
my rig is old now and was only mid ranged when I built it 6 years ago. ,0
NMS is not only one of the best spaces games ,2
 a must have for anyone who loves theme hospital - extremely good fun,1
but for playing with mouse + keyboard they're a pain.,0
"Personally, I have trouble playing games when there's no progression, unlocks, secrets or achievements.",0
"tpc has 3 game modes: 1) a campaign mode where you have a specific objective (e.g. modernizing the courses of a campus), and by unlocking the first star of challenges, you will unlock a new campus and each subsequent star beyond the first, will unlock new things (courses, items and events) that you can use in the existing game or any other game you jump into.2) sandbox with various difficulty settings, with the ability to pick the campus.3) challenge mode with specific requirements to earn the most points (e.g. 2023 valentine is day event is to make as many people fall in love as possible within a certain time limit.",1
PS : steam plz add fran-glish in the language :d,1
" any number of resource management games, space trade and combat like Eve,",2
"but with some cracks that needs fixing, ",0
"it is a bit too easy, thus far; unlike the first original theme hospital, it looks like failing is not really something that is going to happen a lot, the difficulty does not seem to ramp up.",0
it is too much waiting in this game. and what you have to do is done quickly and then you have to wait for a long time again before you can do some more in the game.,0
My computer meets min specs and can run this game on high ,1
It would benefit greatly from steam workshop compatibility for some variety with regards to wall art and rugs.,2
the developer is twisted sense of humor adds to the games enjoyment.,2
Lobbies are always populated; the community is very collaborative.,2
"As a person who preordered the game, it's been a rollercoaster getting here.",1
35€ game with 75€ in dlcs.,1
 after catching a Twitch stream,1
"tried playing, it and it really feels archaic, simple things like navigating around are slow and cumbersome.",0
"So you're often going to feel bored or lonely whilst playing the game. Play this game in a voice call with friends, or watching something in the background to fill the dead air.",0
"Some mission prompts give you bad information that will send you on wild goose chases - for example there's a mission that tells you to ask lifeforms ""on your planet"" for information, so you'll run all over your planet looking for answers, until you find an obscure line in the mission log contradicting ALL other instructions and telling you to leave the planet and go to a space station. ",0
before saying its a skill issue I’m 38 yrs old played competitive shooters since I was 13.,1
"but beware, if you make them wear gas masks or ballistic face shields, their voice will be muffled, so it's harder to hear their feedback.",1
Really liked adrenaline rush in situations where situations can go from 0 to 100 in mere seconds (e. g. suspects rushing out of door that I was pie-ing),2
" the vibration from first person view makes me feel really sick, and this is why I don't play it that much anymore.",0
"The story was interesting, as I look back on it, but it was a little bit too non linear and overly complicated by the language system, but I did liked the translator and language learning. ",2
"make sure cleanliness, happiness and boredom are controlled. - recruit and train your employees to perform the tasks you have assigned to them.- accept challenges or patients from other hospitals.-  ",2
 fighting pirates,1
 but the finer textures tend to pop or straight up use the lowest res version in some cases (usually npc faces),0
"This game is an inch-deep ocean with nothing visible on the horizon, a silent and monotonous waste of your precious time.",0
I've invested dozens of hours into the game and still have hundreds of hours of gameplay ahead of me. ,2
This is a hard and unforgiving game  ,1
"planets are very static and similar, ",0
